{
  "artifact_type": "data_policy_binding_v1",
  "schema_version": "1.0.0",
  "protocol_version": "1.0",
  "agreement_id": "agr-phase2-child",
  "revision_id": "rev-phase2-child",
  "binding_id": "binding-phase2-001",
  "policy_id": "policy-phase2-001",
  "interpreter_id": "interp-phase2-001",
  "policy_hash": "sha256:phase2policy",
  "created_at": "2026-03-19T02:06:00Z"
}
